{
 "source_id": "src_fi_allagate1966",
 "title": "Aree allagate dall'alluvione del 1966 (Comune di Firenze)",
 "publisher": "Comune di Firenze",
 "dataset_url": "https://dati.toscana.it/dataset/7b27687e-1538-4bb8-a803-952f07560070",
 "resource_url": "https://data.comune.fi.it/datastore/download.php?id=6482&type=99&format=url&file_format=shp&file_id=20198",
 "provenance": {
  "origin": "official_download",
  "note": "T17: dataset https://dati.toscana.it/dataset/7b27687e-1538-4bb8-a803-952f07560070"
 },
 "license": {
  "state": "clear",
  "permitted_use": "redistribution",
  "evidence_url": "https://dati.toscana.it/dataset/7b27687e-1538-4bb8-a803-952f07560070",
  "evidence_note": "Scheda e risorse del catalogo regionale: CC BY 4.0 (package_show del 2026-10-09). Verificata il 2026-10-10.",
  "identifier": "CC-BY-4.0"
 },
 "content_period": {
  "start": "1966-11-04",
  "end": "1966-11-04",
  "note": "evento del 4 novembre 1966; file dello zip del 2013-01-18"
 },
 "crs": {
  "declared": "EPSG:3003",
  "vertical_datum": "not_declared",
  "note": "CRS letto dal .prj dello shapefile (EPSG:3003) e convertito in EPSG:7791: il .prj è Monte Mario con meridiano di Roma (Gauss-Boaga fuso Ovest scritto rispetto a Roma), equivalente a EPSG:3003; pyogrio non lo riconosce e il CRS è impostato a mano"
 },
 "units": {},
 "checks": [
  {
   "name": "aree allagate dall'alluvione del 1966 in area allargata",
   "result": "pass",
   "detail": "3 oggetti"
  },
  {
   "name": "limite",
   "result": "warn",
   "detail": "classi di profondità dell'acqua (0-2, 2-4, 4-5 m) ricavate dalle curve di isoprofondità: evento storico, non scenario attuale"
  }
 ],
 "schema_fields": [
  "AREE_ALLAG"
 ]
}