{
 "source_id": "src_fi_barriere",
 "title": "Censimento delle barriere architettoniche e urbanistiche, Comune di Firenze",
 "publisher": "Comune di Firenze",
 "dataset_url": "https://dati.toscana.it/dataset/92033b63-0598-4449-9007-22127abe505a",
 "resource_url": "https://datigis.comune.fi.it/shp/mappa_accessibilita.zip",
 "provenance": {
  "origin": "official_download",
  "note": "T17: dataset https://dati.toscana.it/dataset/92033b63-0598-4449-9007-22127abe505a"
 },
 "license": {
  "state": "clear",
  "permitted_use": "redistribution",
  "evidence_url": "https://dati.toscana.it/dataset/92033b63-0598-4449-9007-22127abe505a",
  "evidence_note": "Scheda e risorse del catalogo regionale: CC BY 4.0 (package_show del 2026-10-09).",
  "identifier": "CC-BY-4.0"
 },
 "content_period": {
  "start": "2013-01-01",
  "end": "2013-12-31",
  "note": "archivio dichiarato aggiornato al 2013; file dello zip del 2016-09-13; frequenza NOT_PLANNED"
 },
 "crs": {
  "declared": "EPSG:3003",
  "vertical_datum": "not_declared",
  "note": "shapefile con .prj in Monte Mario Italia zona 1; convertito in EPSG:7791 come a Pisa"
 },
 "units": {},
 "checks": [
  {
   "name": "barriere in area allargata",
   "result": "pass",
   "detail": "222 oggetti"
  },
  {
   "name": "natura del dato",
   "result": "warn",
   "detail": "schede di accessibilità di edifici (rilievo 2013), non ostacoli sul percorso"
  }
 ],
 "schema_fields": [
  "pk_id",
  "quartiere",
  "utoe",
  "scheda",
  "destinaz_u",
  "indirizzo",
  "grado_acce",
  "url"
 ]
}