{
 "source_id": "src_fi_car_sharing",
 "title": "Posti auto riservati al car sharing (Comune di Firenze)",
 "publisher": "Comune di Firenze",
 "dataset_url": "https://dati.toscana.it/dataset/66de7a99-a435-45d7-8ad0-6a1caf88c943",
 "resource_url": "https://data.comune.fi.it/datastore/download.php?id=6563&type=99&format=url&file_format=shp&file_id=20352",
 "provenance": {
  "origin": "official_download",
  "note": "T17: dataset https://dati.toscana.it/dataset/66de7a99-a435-45d7-8ad0-6a1caf88c943"
 },
 "license": {
  "state": "clear",
  "permitted_use": "redistribution",
  "evidence_url": "https://dati.toscana.it/dataset/66de7a99-a435-45d7-8ad0-6a1caf88c943",
  "evidence_note": "Scheda e risorse del catalogo regionale: CC BY 4.0 (package_show del 2026-10-09). Verificata il 2026-10-10.",
  "identifier": "CC-BY-4.0"
 },
 "content_period": {
  "note": "scheda aggiornata il 2026-02-11, data di rilievo non dichiarata"
 },
 "crs": {
  "declared": "EPSG:3003",
  "vertical_datum": "not_declared",
  "note": "CRS letto dal .prj dello shapefile (EPSG:3003) e convertito in EPSG:7791"
 },
 "units": {},
 "checks": [
  {
   "name": "posti auto riservati al car sharing in area allargata",
   "result": "pass",
   "detail": "9 oggetti"
  },
  {
   "name": "limite",
   "result": "warn",
   "detail": "solo la posizione, nessun attributo"
  }
 ],
 "schema_fields": [
  "id"
 ]
}