{
 "source_id": "src_rt_censimento2011",
 "title": "XV Censimento della popolazione e delle abitazioni 2011, dati per sezione di censimento (Toscana)",
 "publisher": "Regione Toscana (dati Istat)",
 "dataset_url": "https://dati.toscana.it/dataset/xv-censpop-2011-datisez",
 "resource_url": "https://dati.toscana.it/dataset/46c34b90-92dd-4bd8-ab19-398da5dc933c/resource/1a338a93-65be-45a2-86a0-e13578ce953c/download/r09indicatori2011sezioni.csv",
 "provenance": {
  "origin": "official_download",
  "note": "T17: dataset https://dati.toscana.it/dataset/xv-censpop-2011-datisez"
 },
 "license": {
  "state": "clear_with_reserve",
  "permitted_use": "redistribution",
  "evidence_url": "https://dati.toscana.it/dataset/xv-censpop-2011-datisez",
  "evidence_note": "Scheda del catalogo regionale: licenza cc-by (package_show del 2026-10-10).",
  "identifier": "CC-BY",
  "reserve_note": "La scheda non indica la versione della licenza CC BY: attribuzione a Regione Toscana e Istat in ogni caso."
 },
 "content_period": {
  "start": "2011-10-09",
  "end": "2011-10-09",
  "note": "data di riferimento del censimento 2011; scheda aggiornata il 2023-09-05"
 },
 "crs": {
  "declared": "undeclared",
  "vertical_datum": "not_declared",
  "note": "tabella senza geometria: agganciata ai poligoni di src_fi_sezioni2011 con SEZ2011 = 48017 x 10^7 + CODSEZ2011"
 },
 "units": {
  "P1": "persone"
 },
 "checks": [
  {
   "name": "aggancio alle sezioni",
   "result": "pass",
   "detail": "solo P1 (residenti); aggancio sull'intero comune: 2.067 sezioni su 2.185 (le altre senza riga nel CSV)"
  },
  {
   "name": "anno",
   "result": "warn",
   "detail": "censimento 2011: Novoli è cambiato da allora (nuove residenze e studentati)"
  }
 ],
 "schema_fields": [
  "PROCOM",
  "SEZ2011",
  "P1"
 ]
}