{
 "source_id": "src_fi_tram_fermate",
 "title": "Fermate tram, Comune di Firenze",
 "publisher": "Comune di Firenze",
 "dataset_url": "https://dati.toscana.it/dataset/607b8031-252b-4442-950a-7b4452d9db8f",
 "resource_url": "https://datigis.comune.fi.it/shp/tram_fermate.zip",
 "provenance": {
  "origin": "official_download",
  "note": "T17: dataset https://dati.toscana.it/dataset/607b8031-252b-4442-950a-7b4452d9db8f"
 },
 "license": {
  "state": "clear",
  "permitted_use": "redistribution",
  "evidence_url": "https://dati.toscana.it/dataset/607b8031-252b-4442-950a-7b4452d9db8f",
  "evidence_note": "Scheda e risorse del catalogo regionale: CC BY 4.0 (package_show del 2026-10-09).",
  "identifier": "CC-BY-4.0"
 },
 "content_period": {
  "start": "2025-03-11",
  "end": "2025-03-11",
  "note": "dato dichiarato del 2025-03-11"
 },
 "crs": {
  "declared": "undeclared",
  "vertical_datum": "not_declared",
  "note": "CRS letto dal .prj dello shapefile e convertito in EPSG:7791"
 },
 "units": {},
 "checks": [
  {
   "name": "fermate in area allargata",
   "result": "pass",
   "detail": "10 fermate"
  }
 ]
}