{
 "source_id": "src_fi_aree_sportive",
 "title": "Aree sportive (Comune di Firenze)",
 "publisher": "Comune di Firenze",
 "dataset_url": "https://dati.toscana.it/dataset/04a78eba-5eb4-48e7-92b4-f16c7b3aa63a",
 "resource_url": "https://data.comune.fi.it/datastore/download.php?id=6375&type=99&format=url&file_format=shp&file_id=19941",
 "provenance": {
  "origin": "official_download",
  "note": "T17: dataset https://dati.toscana.it/dataset/04a78eba-5eb4-48e7-92b4-f16c7b3aa63a"
 },
 "license": {
  "state": "clear",
  "permitted_use": "redistribution",
  "evidence_url": "https://dati.toscana.it/dataset/04a78eba-5eb4-48e7-92b4-f16c7b3aa63a",
  "evidence_note": "Scheda e risorse del catalogo regionale: CC BY 4.0 (package_show del 2026-10-09). Verificata il 2026-10-10.",
  "identifier": "CC-BY-4.0"
 },
 "content_period": {
  "note": "scheda aggiornata il 2026-02-11, data di rilievo non dichiarata"
 },
 "crs": {
  "declared": "EPSG:3003",
  "vertical_datum": "not_declared",
  "note": "CRS letto dal .prj dello shapefile (EPSG:3003) e convertito in EPSG:7791"
 },
 "units": {
  "SUPMQAREA": "m2"
 },
 "checks": [
  {
   "name": "aree sportive in area allargata",
   "result": "pass",
   "detail": "16 oggetti"
  }
 ],
 "schema_fields": [
  "IDOBJSTAT",
  "CODAREA",
  "NOMEAREA",
  "QUARTIERE",
  "SUPMQAREA",
  "PROPRIETA",
  "TIPOAREA",
  "TIPOGEST",
  "ENTEGEST"
 ]
}