{
 "source_id": "src_sit_scuole",
 "title": "Scuole (infanzia, primarie, secondarie) del Comune di Pisa (SIT)",
 "publisher": "Comune di Pisa",
 "dataset_url": "https://sit.comune.pisa.it/arcgis/rest/services/Hosted/Scuole_infanzia_materne_primarie_e_secondarie/FeatureServer/0",
 "provenance": {
  "origin": "ogc_service"
 },
 "license": {
  "state": "unproven",
  "permitted_use": "internal_prototype",
  "evidence_url": "https://sit.comune.pisa.it/arcgis/rest/services/Hosted",
  "evidence_note": "Servizio ArcGIS pubblico senza licenza.",
  "reserve_note": "Nessuna licenza dichiarata sul servizio (copyrightText vuoto, scheda del sito senza condizioni di riuso): un endpoint pubblico non prova una licenza. Uso interno al prototipo finche' il Comune non conferma per iscritto."
 },
 "content_period": {
  "note": "layer aggiornato il 2025-11-24 (audit)"
 },
 "crs": {
  "declared": "EPSG:3003",
  "vertical_datum": "not_declared",
  "note": "nativo 102091 (Monte Mario Italy 1 = EPSG:3003)"
 },
 "units": {},
 "schema_fields": [
  "fid",
  "tiposcuola",
  "nomi",
  "via",
  "istit_scol"
 ],
 "checks": [
  {
   "name": "scuole in AOI",
   "result": "pass",
   "detail": "18 punti"
  },
  {
   "name": "codice meccanografico MIM",
   "result": "warn",
   "detail": "assente: nessun dst_ ufficiale ricavabile dal solo SIT"
  }
 ]
}