{
 "source_id": "src_fi_dsm2023",
 "title": "DSM LiDAR 2023 del Comune di Firenze (ASCII grid 0,5 m)",
 "publisher": "Comune di Firenze",
 "dataset_url": "https://dati.toscana.it/dataset/dsm-lidar-2023",
 "resource_url": "https://datigis.comune.fi.it/grid/MDS_LIDAR_2023_ASCII.zip",
 "provenance": {
  "origin": "official_download",
  "note": "T17: dataset https://dati.toscana.it/dataset/dsm-lidar-2023"
 },
 "license": {
  "state": "clear",
  "permitted_use": "redistribution",
  "evidence_url": "https://dati.toscana.it/dataset/dsm-lidar-2023",
  "evidence_note": "Scheda e risorse del catalogo regionale: CC BY 4.0 (package_show del 2026-10-09).",
  "identifier": "CC-BY-4.0"
 },
 "content_period": {
  "start": "2023-06-27",
  "note": "volo 2023-06-27 (giugno: foglie presenti)"
 },
 "crs": {
  "declared": "undeclared",
  "vertical_datum": "not_declared",
  "note": "come il DTM 2023: EPSG:7791 assunto dal prefisso 32_; datum verticale non dichiarato"
 },
 "units": {
  "quota": "m"
 },
 "checks": [
  {
   "name": "raster ritagliato su area allargata",
   "result": "pass",
   "detail": "vedi report_firenze.json"
  },
  {
   "name": "foglie presenti",
   "result": "warn",
   "detail": "volo di giugno: l'ombra invernale va trattata a parte"
  }
 ]
}