{
 "source_id": "src_fi_farmacie",
 "title": "Farmacie autorizzate (Comune di Firenze)",
 "publisher": "Comune di Firenze",
 "dataset_url": "https://dati.toscana.it/dataset/87aaabce-41a5-43d1-b9fe-1282fd882e69",
 "resource_url": "https://data.comune.fi.it/datastore/download.php?id=6413&type=99&format=url&file_format=shp&file_id=20036",
 "provenance": {
  "origin": "official_download",
  "note": "T17: dataset https://dati.toscana.it/dataset/87aaabce-41a5-43d1-b9fe-1282fd882e69"
 },
 "license": {
  "state": "clear",
  "permitted_use": "redistribution",
  "evidence_url": "https://dati.toscana.it/dataset/87aaabce-41a5-43d1-b9fe-1282fd882e69",
  "evidence_note": "Scheda e risorse del catalogo regionale: CC BY 4.0 (package_show del 2026-10-09). Verificata il 2026-10-10.",
  "identifier": "CC-BY-4.0"
 },
 "content_period": {
  "note": "scheda aggiornata il 2026-02-11, data di rilievo non dichiarata"
 },
 "crs": {
  "declared": "EPSG:3003",
  "vertical_datum": "not_declared",
  "note": "CRS letto dal .prj dello shapefile (EPSG:3003) e convertito in EPSG:7791"
 },
 "units": {},
 "checks": [
  {
   "name": "farmacie autorizzate in area allargata",
   "result": "pass",
   "detail": "10 oggetti"
  },
  {
   "name": "limite",
   "result": "warn",
   "detail": "orari e turni non inclusi (sono un altro dataset, giornaliero)"
  }
 ],
 "schema_fields": [
  "ID",
  "DENOMINAZI",
  "VIA",
  "NCIVICO",
  "ESPONENTEC",
  "TIPOCIV"
 ]
}